{
  "GroupId": "sg-0a1b2c3d4e5f60718",
  "InboundRules": [
    {
      "FromPort": 443,
      "ToPort": 443,
      "Protocol": "tcp",
      "Cidr": "10.0.0.0/16"
    }
  ],
  "OutboundRules": [
    {
      "FromPort": 443,
      "ToPort": 443,
      "Protocol": "tcp",
      "Cidr": "10.0.0.0/16"
    }
  ],
  "Instances": [
    {
      "InstanceId": "i-0a1b2c3d4e5f60718",
      "Name": "prod-web-1"
    }
  ]
}